"To look up a company, you can either go through the entire list (which is alphabetically sorted) or use the lookup function that I have built in.",,,,,
Company name,"The Daiei,Inc. (TSE:8263)",Please use the scrolling list to find your company,,,
Industry Group =,Insurance (Life),,,,
Country =,Japan,,,,
Broad Geographical group =,Japan,,,,
Sub Group =,Japan,,,,
"If you want to find the companies in a sector, use the industry sorted worksheet in this spreadsheet",,,,,
,,,,,
,,,,,
Company Name,Exchange:Ticker,Industry Group,Country,Broad Group,Sub Group
"21LADY Co., Ltd. (NSE:3346)",NSE:3346,Retail (Grocery and Food),Japan,Japan,Japan
"3-D Matrix, Ltd. (JASDAQ:7777)",JASDAQ:7777,Drugs (Biotechnology),Japan,Japan,Japan
"4Cs Holdings Co.,Ltd. (TSE:3726)",TSE:3726,Retail (Special Lines),Japan,Japan,Japan
A-One Seimitsu Inc. (JASDAQ:6156),JASDAQ:6156,Machinery,Japan,Japan,Japan
"A.D.Works Co.,Ltd. (TSE:3250)",TSE:3250,Real Estate (Operations & Services),Japan,Japan,Japan
A&A Material Corporation (TSE:5391),TSE:5391,Building Materials,Japan,Japan,Japan
"A&D Company, Limited (TSE:7745)",TSE:7745,Electronics (General),Japan,Japan,Japan
A&T Corporation (JASDAQ:6722),JASDAQ:6722,Healthcare Products,Japan,Japan,Japan
"AAP, Inc. (OTCPK:AAPJ)",OTCPK:AAPJ,Farming/Agriculture,Japan,Japan,Japan
"ABC-Mart, Inc. (TSE:2670)",TSE:2670,Retail (Special Lines),Japan,Japan,Japan
"Abist Co.,Ltd. (TSE:6087)",TSE:6087,Business & Consumer Services,Japan,Japan,Japan
"Access Company, Ltd. (TSE:4813)",TSE:4813,Software (Internet),Japan,Japan,Japan
"Accordia Golf Co., Ltd. (TSE:2131)",TSE:2131,Recreation,Japan,Japan,Japan
"Accretive Co., Ltd. (TSE:8423)",TSE:8423,Financial Svcs. (Non-bank & Insurance),Japan,Japan,Japan
Achilles Corporation (TSE:5142),TSE:5142,Chemical (Basic),Japan,Japan,Japan
ACKG Limited (JASDAQ:2498),JASDAQ:2498,Engineering/Construction,Japan,Japan,Japan
Acmos Inc. (JASDAQ:6888),JASDAQ:6888,Software (System & Application),Japan,Japan,Japan
"Acom Co., Ltd. (TSE:8572)",TSE:8572,Financial Svcs. (Non-bank & Insurance),Japan,Japan,Japan
"Acrodea, Inc. (TSE:3823)",TSE:3823,Software (System & Application),Japan,Japan,Japan
Actcall Inc. (TSE:6064),TSE:6064,Real Estate (Operations & Services),Japan,Japan,Japan
Ad-Sol Nissin Corporation (JASDAQ:3837),JASDAQ:3837,Computer Services,Japan,Japan,Japan
"Adastria Co., Ltd. (TSE:2685)",TSE:2685,Retail (Special Lines),Japan,Japan,Japan
Adeka Corporation (TSE:4401),TSE:4401,Chemical (Basic),Japan,Japan,Japan
Aderans Company Limited (TSE:8170),TSE:8170,Household Products,Japan,Japan,Japan
"Adjuvant Cosme Japan Co.,Ltd. (TSE:4929)",TSE:4929,Household Products,Japan,Japan,Japan
"ADORES, Inc. (JASDAQ:4712)",JASDAQ:4712,Recreation,Japan,Japan,Japan
"Adtec Plasma Technology Co., Ltd. (TSE:6668)",TSE:6668,Electronics (General),Japan,Japan,Japan
Advan Co. Ltd. (TSE:7463),TSE:7463,Retail (Distributors),Japan,Japan,Japan
"Advance Create Co., Ltd. (TSE:8798)",TSE:8798,Insurance (Life),Japan,Japan,Japan
Advance Residence Investment Corporation (TSE:3269),TSE:3269,R.E.I.T.,Japan,Japan,Japan
"Advanced Media, Inc. (TSE:3773)",TSE:3773,Software (System & Application),Japan,Japan,Japan
Advanex Inc. (TSE:5998),TSE:5998,Machinery,Japan,Japan,Japan
"Advantage Risk Management Co., Ltd. (JASDAQ:8769)",JASDAQ:8769,Hospitals/Healthcare Facilities,Japan,Japan,Japan
Advantest Corporation (TSE:6857),TSE:6857,Semiconductor Equip,Japan,Japan,Japan
Adventure Inc. (TSE:6030),TSE:6030,Hotel/Gaming,Japan,Japan,Japan
Adways Inc. (TSE:2489),TSE:2489,Advertising,Japan,Japan,Japan
"Aeon Co., Ltd. (TSE:8267)",TSE:8267,Retail (General),Japan,Japan,Japan
Aeon Delight Co Ltd. (TSE:9787),TSE:9787,Environmental & Waste Services,Japan,Japan,Japan
"Aeon Fantasy Co., Ltd. (TSE:4343)",TSE:4343,Recreation,Japan,Japan,Japan
"AEON Financial Service Co., Ltd. (TSE:8570)",TSE:8570,Financial Svcs. (Non-bank & Insurance),Japan,Japan,Japan
Aeon Hokkaido Corporation (TSE:7512),TSE:7512,Retail (Grocery and Food),Japan,Japan,Japan
"Aeon Kyushu Co., Ltd. (JASDAQ:2653)",JASDAQ:2653,Retail (General),Japan,Japan,Japan
"ÆON Mall Co., Ltd. (TSE:8905)",TSE:8905,Real Estate (Operations & Services),Japan,Japan,Japan
AEON REIT Investment Corporation (TSE:3292),TSE:3292,R.E.I.T.,Japan,Japan,Japan
Aeria Inc. (JASDAQ:3758),JASDAQ:3758,Software (Entertainment),Japan,Japan,Japan
"AFC-HD AMS Life Science Co., Ltd. (JASDAQ:2927)",JASDAQ:2927,Household Products,Japan,Japan,Japan
"AGORA Hospitality Group Co., Ltd (TSE:9704)",TSE:9704,Hotel/Gaming,Japan,Japan,Japan
AGP Corporation (JASDAQ:9377),JASDAQ:9377,Air Transport,Japan,Japan,Japan
Agro-Kanesho Co. Ltd. (TSE:4955),TSE:4955,Chemical (Specialty),Japan,Japan,Japan
AGS Corporation (TSE:3648),TSE:3648,Computer Services,Japan,Japan,Japan
"Ahjikan Co., Ltd. (TSE:2907)",TSE:2907,Food Processing,Japan,Japan,Japan
"Ahkun Co., Ltd. (TSE:3927)",TSE:3927,Software (System & Application),Japan,Japan,Japan
Ahresty Corporation (TSE:5852),TSE:5852,Auto Parts,Japan,Japan,Japan
Ai Holdings Corporation (TSE:3076),TSE:3076,Electronics (General),Japan,Japan,Japan
"AICA Kogyo Co., Ltd. (TSE:4206)",TSE:4206,Building Materials,Japan,Japan,Japan
Aichi Corporation (TSE:6345),TSE:6345,Construction Supplies,Japan,Japan,Japan
"Aichi Electric Co., Ltd. (NSE:6623)",NSE:6623,Electrical Equipment,Japan,Japan,Japan
Aichi Steel Corp. (TSE:5482),TSE:5482,Steel,Japan,Japan,Japan
"Aichi Tokei Denki Co., Ltd. (TSE:7723)",TSE:7723,Electronics (General),Japan,Japan,Japan
"Aida Engineering, Ltd. (TSE:6118)",TSE:6118,Machinery,Japan,Japan,Japan
AIFUL Corporation (TSE:8515),TSE:8515,Financial Svcs. (Non-bank & Insurance),Japan,Japan,Japan
"Aigan Co., Ltd. (TSE:9854)",TSE:9854,Retail (Special Lines),Japan,Japan,Japan
Aiko Corporation (JASDAQ:9909),JASDAQ:9909,Retail (Distributors),Japan,Japan,Japan
Aiming Inc. (TSE:3911),TSE:3911,Software (System & Application),Japan,Japan,Japan
Ain Holdings Inc. (TSE:9627),TSE:9627,Retail (Special Lines),Japan,Japan,Japan
"Ainavo Holdings Co., Ltd. (JASDAQ:7539)",JASDAQ:7539,Homebuilding,Japan,Japan,Japan
"Aiphone Co., Ltd. (TSE:6718)",TSE:6718,Telecom. Equipment,Japan,Japan,Japan
Air Water Inc. (TSE:4088),TSE:4088,Power,Japan,Japan,Japan
Airex Inc. (JASDAQ:6944),JASDAQ:6944,Semiconductor,Japan,Japan,Japan
"Airport Facilities Co., Ltd. (TSE:8864)",TSE:8864,Real Estate (Operations & Services),Japan,Japan,Japan
"Airtech Japan,Ltd. (TSE:6291)",TSE:6291,Machinery,Japan,Japan,Japan
Aisan Industry Co. Ltd. (TSE:7283),TSE:7283,Auto Parts,Japan,Japan,Japan
"Aisan Technology Co., Ltd. (JASDAQ:4667)",JASDAQ:4667,Software (System & Application),Japan,Japan,Japan
"Aisei Pharmacy Co.,Ltd. (JASDAQ:3170)",JASDAQ:3170,Retail (Special Lines),Japan,Japan,Japan
"Aisin Seiki Co., Ltd. (TSE:7259)",TSE:7259,Auto Parts,Japan,Japan,Japan
AIT Corporation (TSE:9381),TSE:9381,Transportation,Japan,Japan,Japan
"Aizawa Securities Co., Ltd. (TSE:8708)",TSE:8708,Brokerage & Investment Banking,Japan,Japan,Japan
"Ajinomoto Co., Inc. (TSE:2802)",TSE:2802,Food Processing,Japan,Japan,Japan
"AJIS Co., Ltd. (JASDAQ:4659)",JASDAQ:4659,Business & Consumer Services,Japan,Japan,Japan
Akasaka Diesels Limited (TSE:6022),TSE:6022,Construction Supplies,Japan,Japan,Japan
"Akatsuki Eazima Co., Ltd. (JASDAQ:1997)",JASDAQ:1997,Engineering/Construction,Japan,Japan,Japan
"Akatsuki Financial Group, Inc. (TSE:8737)",TSE:8737,Brokerage & Investment Banking,Japan,Japan,Japan
Akebono Brake Industry Co. Ltd. (TSE:7238),TSE:7238,Auto Parts,Japan,Japan,Japan
"Akiba Holdings Co., Ltd. (JASDAQ:6840)",JASDAQ:6840,Computers/Peripherals,Japan,Japan,Japan
"Akikawa Foods & Farms Co., Ltd. (JASDAQ:1380)",JASDAQ:1380,Food Processing,Japan,Japan,Japan
ALBERT Inc. (TSE:3906),TSE:3906,Software (Internet),Japan,Japan,Japan
"ALBIS Co.,Ltd. (TSE:7475)",TSE:7475,Retail (Grocery and Food),Japan,Japan,Japan
ALCONIX Corporation (TSE:3036),TSE:3036,Metals & Mining,Japan,Japan,Japan
Alfresa Holdings Corporation (TSE:2784),TSE:2784,Healthcare Support Services,Japan,Japan,Japan
Alinco Incorporated (TSE:5933),TSE:5933,Machinery,Japan,Japan,Japan
"All About, Inc. (JASDAQ:2454)",JASDAQ:2454,Software (Internet),Japan,Japan,Japan
"Allied Architects, Inc. (TSE:6081)",TSE:6081,Advertising,Japan,Japan,Japan
Allied Telesis Holdings K.K. (TSE:6835),TSE:6835,Telecom. Equipment,Japan,Japan,Japan
Almedio Inc. (TSE:7859),TSE:7859,Electronics (General),Japan,Japan,Japan
"Almetax Manufacturing Co., Ltd. (TSE:5928)",TSE:5928,Building Materials,Japan,Japan,Japan
"Alpen Co., Ltd. (TSE:3028)",TSE:3028,Retail (Special Lines),Japan,Japan,Japan
"Alpha Co., Ltd. (JASDAQ:4760)",JASDAQ:4760,Advertising,Japan,Japan,Japan
ALPHA Corporation (TSE:3434),TSE:3434,Auto Parts,Japan,Japan,Japan
Alpha Group Inc. (JASDAQ:3322),JASDAQ:3322,Retail (Special Lines),Japan,Japan,Japan
Alpha Systems Inc. (TSE:4719),TSE:4719,Software (System & Application),Japan,Japan,Japan
"AlphaPolis Co.,Ltd. (TSE:9467)",TSE:9467,Publshing & Newspapers,Japan,Japan,Japan
"Alphax Food System Co.,Ltd (JASDAQ:3814)",JASDAQ:3814,Computer Services,Japan,Japan,Japan
"Alpine Electronics, Inc. (TSE:6816)",TSE:6816,Electronics (Consumer & Office),Japan,Japan,Japan
Alps Electric Co. Ltd. (TSE:6770),TSE:6770,Electronics (General),Japan,Japan,Japan
"Alps Logistics Co., Ltd. (TSE:9055)",TSE:9055,Trucking,Japan,Japan,Japan
Altech Co. Ltd. (TSE:9972),TSE:9972,Retail (Distributors),Japan,Japan,Japan
Altech Corporation (TSE:4641),TSE:4641,Business & Consumer Services,Japan,Japan,Japan
Altplus Inc. (TSE:3672),TSE:3672,Software (Entertainment),Japan,Japan,Japan
"Amada Holdings Co., Ltd. (TSE:6113)",TSE:6113,Machinery,Japan,Japan,Japan
Amagasa Co. Ltd. (JASDAQ:3070),JASDAQ:3070,Shoe,Japan,Japan,Japan
amana inc. (TSE:2402),TSE:2402,Entertainment,Japan,Japan,Japan
Amano Corp. (TSE:6436),TSE:6436,Electronics (General),Japan,Japan,Japan
Amatei Incorporated (TSE:5952),TSE:5952,Building Materials,Japan,Japan,Japan
"Amaze Co.,Ltd. (FKSE:6076)",FKSE:6076,Hotel/Gaming,Japan,Japan,Japan
Ambition Corporation (TSE:3300),TSE:3300,Real Estate (Operations & Services),Japan,Japan,Japan
"Amita Holdings Co., Ltd. (JASDAQ:2195)",JASDAQ:2195,Environmental & Waste Services,Japan,Japan,Japan
"Amiyaki Tei Co., Ltd. (TSE:2753)",TSE:2753,Restaurant/Dining,Japan,Japan,Japan
AMUSE Inc. (TSE:4301),TSE:4301,Entertainment,Japan,Japan,Japan
ANA Holdings Inc. (TSE:9202),TSE:9202,Air Transport,Japan,Japan,Japan
Anabuki Kosan Inc. (TSE:8928),TSE:8928,Real Estate (General/Diversified),Japan,Japan,Japan
ANAP Inc. (JASDAQ:3189),JASDAQ:3189,Retail (Special Lines),Japan,Japan,Japan
"Andor Co., Ltd. (JASDAQ:4640)",JASDAQ:4640,Computer Services,Japan,Japan,Japan
ANEST IWATA Corporation (TSE:6381),TSE:6381,Machinery,Japan,Japan,Japan
"AnGes MG, Inc. (TSE:4563)",TSE:4563,Drugs (Biotechnology),Japan,Japan,Japan
"Anicom Holdings, Inc. (TSE:8715)",TSE:8715,Insurance (Prop/Cas.),Japan,Japan,Japan
"Anrakutei Co., Ltd. (TSE:7562)",TSE:7562,Restaurant/Dining,Japan,Japan,Japan
Anritsu Corp. (TSE:6754),TSE:6754,Electronics (General),Japan,Japan,Japan
"Anshin Guarantor Service Co., Ltd. (TSE:7183)",TSE:7183,Financial Svcs. (Non-bank & Insurance),Japan,Japan,Japan
Aohata Corporation (TSE:2830),TSE:2830,Food Processing,Japan,Japan,Japan
"AOI Electronics Co., Ltd. (TSE:6832)",TSE:6832,Semiconductor,Japan,Japan,Japan
AOI Pro.Inc. (TSE:9607),TSE:9607,Advertising,Japan,Japan,Japan
AOKI Holdings Inc. (TSE:8214),TSE:8214,Retail (Special Lines),Japan,Japan,Japan
"Aoki Super Co., LTD. (JASDAQ:9977)",JASDAQ:9977,Retail (Grocery and Food),Japan,Japan,Japan
"Aoyama Trading Company, Ltd. (TSE:8219)",TSE:8219,Retail (Special Lines),Japan,Japan,Japan
Aoyama Zaisan Networks Company Limited (TSE:8929),TSE:8929,Real Estate (Operations & Services),Japan,Japan,Japan
"Aozora Bank, Ltd. (TSE:8304)",TSE:8304,Bank (Money Center),Japan,Japan,Japan
"AP Company Co., Ltd. (TSE:3175)",TSE:3175,Restaurant/Dining,Japan,Japan,Japan
"Apamanshop Holdings Co.,Ltd. (JASDAQ:8889)",JASDAQ:8889,Real Estate (Operations & Services),Japan,Japan,Japan
Apic Yamada Corporation (TSE:6300),TSE:6300,Semiconductor Equip,Japan,Japan,Japan
Aplix IP Holdings Corporation (TSE:3727),TSE:3727,Software (System & Application),Japan,Japan,Japan
"APLUS FINANCIAL Co., Ltd. (TSE:8589)",TSE:8589,Financial Svcs. (Non-bank & Insurance),Japan,Japan,Japan
"AppBank Co., Ltd. (TSE:6177)",TSE:6177,Retail (Online),Japan,Japan,Japan
"Apple International Co., Ltd. (TSE:2788)",TSE:2788,Retail (Automotive),Japan,Japan,Japan
"Applied Co.,Ltd. (JASDAQ:3020)",JASDAQ:3020,Retail (Special Lines),Japan,Japan,Japan
"Applied Technology Co., Ltd. (JASDAQ:4356)",JASDAQ:4356,Computer Services,Japan,Japan,Japan
Aqua Power Systems Inc. (OTCPK:APSI),OTCPK:APSI,Electrical Equipment,Japan,Japan,Japan
Aqualine Ltd. (TSE:6173),TSE:6173,Business & Consumer Services,Japan,Japan,Japan
"Arakawa Chemical Industries, Ltd. (TSE:4968)",TSE:4968,Chemical (Basic),Japan,Japan,Japan
Arata Corporation (TSE:2733),TSE:2733,Retail (Distributors),Japan,Japan,Japan
"Araya Industrial Co., Ltd. (TSE:7305)",TSE:7305,Steel,Japan,Japan,Japan
"Arbeit-Times Co., Ltd. (JASDAQ:2341)",JASDAQ:2341,Publshing & Newspapers,Japan,Japan,Japan
Architects Studio Japan Inc. (TSE:6085),TSE:6085,Business & Consumer Services,Japan,Japan,Japan
"Arcland Sakamoto Co., Ltd. (TSE:9842)",TSE:9842,Retail (Building Supply),Japan,Japan,Japan
"ArcLand Service Co., Ltd. (TSE:3085)",TSE:3085,Restaurant/Dining,Japan,Japan,Japan
ARCS Company Limited (TSE:9948),TSE:9948,Retail (Grocery and Food),Japan,Japan,Japan
"ARDEPRO Co., Ltd. (TSE:8925)",TSE:8925,Real Estate (Development),Japan,Japan,Japan
Area Quest Inc (TSE:8912),TSE:8912,Real Estate (Operations & Services),Japan,Japan,Japan
"Arealink Co.,Ltd. (TSE:8914)",TSE:8914,Real Estate (Operations & Services),Japan,Japan,Japan
Argo Graphics Inc. (TSE:7595),TSE:7595,Computer Services,Japan,Japan,Japan
"ARIAKE JAPAN Co., Ltd. (TSE:2815)",TSE:2815,Food Processing,Japan,Japan,Japan
"Arigatou Services Company,Limited (JASDAQ:3177)",JASDAQ:3177,Restaurant/Dining,Japan,Japan,Japan
"Arisawa Manufacturing Co., Ltd. (TSE:5208)",TSE:5208,Electronics (General),Japan,Japan,Japan
"Arkcore, Inc. (NSE:3384)",NSE:3384,Retail (Automotive),Japan,Japan,Japan
ARRK Corporation (TSE:7873),TSE:7873,Business & Consumer Services,Japan,Japan,Japan
"Art Green Co., Ltd. (NSE:3419)",NSE:3419,Retail (Distributors),Japan,Japan,Japan
"Art Vivant Co., Ltd. (JASDAQ:7523)",JASDAQ:7523,Retail (Special Lines),Japan,Japan,Japan
"ARTE Salon Holdings, Inc. (JASDAQ:2406)",JASDAQ:2406,Business & Consumer Services,Japan,Japan,Japan
"Artiza Networks, Inc. (TSE:6778)",TSE:6778,Telecom. Equipment,Japan,Japan,Japan
"Artnature, Inc. (TSE:7823)",TSE:7823,Household Products,Japan,Japan,Japan
Artner Company Ltd. (JASDAQ:2163),JASDAQ:2163,Business & Consumer Services,Japan,Japan,Japan
artra corporation (TSE:6029),TSE:6029,Healthcare Support Services,Japan,Japan,Japan
ArtSpark Holdings Inc. (TSE:3663),TSE:3663,Software (System & Application),Japan,Japan,Japan
As One Corp. (TSE:7476),TSE:7476,Healthcare Support Services,Japan,Japan,Japan
"As-me ESTELLE CO., LTD. (TSE:7872)",TSE:7872,Apparel,Japan,Japan,Japan
Asagami Corporation (TSE:9311),TSE:9311,Shipbuilding & Marine,Japan,Japan,Japan
Asahi Broadcasting Corporation (TSE:9405),TSE:9405,Broadcasting,Japan,Japan,Japan
"ASAHI CO.,LTD. (TSE:3333)",TSE:3333,Retail (Special Lines),Japan,Japan,Japan
"Asahi Concrete Works Co., Ltd. (TSE:5268)",TSE:5268,Construction Supplies,Japan,Japan,Japan
Asahi Diamond Industrial Co. Ltd. (TSE:6140),TSE:6140,Machinery,Japan,Japan,Japan
Asahi Eito Co. Ltd. (TSE:5341),TSE:5341,Building Materials,Japan,Japan,Japan
Asahi Glass Co. Ltd. (TSE:5201),TSE:5201,Building Materials,Japan,Japan,Japan
"Asahi Group Holdings, Ltd. (TSE:2502)",TSE:2502,Beverage (Alcoholic),Japan,Japan,Japan
"Asahi Holdings,Inc. (TSE:5857)",TSE:5857,Precious Metals,Japan,Japan,Japan
"Asahi Industries Co., Ltd. (JASDAQ:5456)",JASDAQ:5456,Steel,Japan,Japan,Japan
"Asahi Intecc Co., Ltd. (TSE:7747)",TSE:7747,Healthcare Products,Japan,Japan,Japan
"Asahi Intelligence Service Co., Ltd. (TSE:9799)",TSE:9799,Computer Services,Japan,Japan,Japan
"Asahi Kagaku Kogyo Co., Ltd. (JASDAQ:7928)",JASDAQ:7928,Chemical (Basic),Japan,Japan,Japan
Asahi Kasei Corporation (TSE:3407),TSE:3407,Chemical (Basic),Japan,Japan,Japan
"Asahi Kogyosha Co., Ltd. (TSE:1975)",TSE:1975,Engineering/Construction,Japan,Japan,Japan
"ASAHI Net, Inc. (TSE:3834)",TSE:3834,Software (Internet),Japan,Japan,Japan
"Asahi Organic Chemicals Industry Co., Ltd. (TSE:4216)",TSE:4216,Chemical (Basic),Japan,Japan,Japan
"Asahi Printing Co.,Ltd. (TSE:3951)",TSE:3951,Packaging & Container,Japan,Japan,Japan
Asahi Rubber Inc. (JASDAQ:5162),JASDAQ:5162,Machinery,Japan,Japan,Japan
"Asahi-Seiki Manufacturing Co., Ltd. (NSE:6111)",NSE:6111,Machinery,Japan,Japan,Japan
"Asahimatsu Foods Co., Ltd. (TSE:2911)",TSE:2911,Food Processing,Japan,Japan,Japan
Asahipen Corporation (TSE:4623),TSE:4623,Chemical (Basic),Japan,Japan,Japan
"Asaka Industrial Co., Ltd. (TSE:5962)",TSE:5962,Furn/Home Furnishings,Japan,Japan,Japan
"Asaka Riken Co., Ltd. (JASDAQ:5724)",JASDAQ:5724,Environmental & Waste Services,Japan,Japan,Japan
Asante Incorporated (TSE:6073),TSE:6073,Business & Consumer Services,Japan,Japan,Japan
Asanuma Corporation (TSE:1852),TSE:1852,Engineering/Construction,Japan,Japan,Japan
Asatsu-DK Inc. (TSE:9747),TSE:9747,Advertising,Japan,Japan,Japan
"Asax Co., Ltd. (TSE:8772)",TSE:8772,Financial Svcs. (Non-bank & Insurance),Japan,Japan,Japan
Ascot Corp. (JASDAQ:3264),JASDAQ:3264,Real Estate (General/Diversified),Japan,Japan,Japan
"Aseed Holdings Co.,Ltd. (TSE:9959)",TSE:9959,Retail (Special Lines),Japan,Japan,Japan
"Asgent, Inc. (JASDAQ:4288)",JASDAQ:4288,Software (Internet),Japan,Japan,Japan
"Ashikaga Holdings Co., Ltd. (TSE:7167)",TSE:7167,Banks (Regional),Japan,Japan,Japan
"Ashimori Industry Co., Ltd. (TSE:3526)",TSE:3526,Auto Parts,Japan,Japan,Japan
"Asia Air Survey Co., Ltd. (TSE:9233)",TSE:9233,Business & Consumer Services,Japan,Japan,Japan
Asia Development Capital Co. Ltd. (TSE:9318),TSE:9318,Investments & Asset Management,Japan,Japan,Japan
"Asia Gate Holdings Co., Ltd. (JASDAQ:1783)",JASDAQ:1783,Engineering/Construction,Japan,Japan,Japan
"Asia Growth Capital, Ltd. (TSE:6993)",TSE:6993,Electrical Equipment,Japan,Japan,Japan
Asia Pile Holdings Corporation (TSE:5288),TSE:5288,Construction Supplies,Japan,Japan,Japan
Asian Star Co. (JASDAQ:8946),JASDAQ:8946,Real Estate (Development),Japan,Japan,Japan
ASICS Corp. (TSE:7936),TSE:7936,Shoe,Japan,Japan,Japan
ASJ Inc. (TSE:2351),TSE:2351,Software (Internet),Japan,Japan,Japan
Aska Corp. (NSE:7227),NSE:7227,Auto Parts,Japan,Japan,Japan
ASKA Pharmaceutical Co.Ltd. (TSE:4514),TSE:4514,Drugs (Pharmaceutical),Japan,Japan,Japan
ASKUL Corporation (TSE:2678),TSE:2678,Retail (Special Lines),Japan,Japan,Japan
Asmo Corporation (TSE:2654),TSE:2654,Food Wholesalers,Japan,Japan,Japan
"Aso Foam Crete Co.,Ltd. (JASDAQ:1730)",JASDAQ:1730,Engineering/Construction,Japan,Japan,Japan
"Asrapport Dining Co., Ltd. (JASDAQ:3069)",JASDAQ:3069,Restaurant/Dining,Japan,Japan,Japan
"Astellas Pharma, Inc. (TSE:4503)",TSE:4503,Drugs (Pharmaceutical),Japan,Japan,Japan
Asti Corporation (TSE:6899),TSE:6899,Auto Parts,Japan,Japan,Japan
"ASTMAX Co., Ltd. (JASDAQ:7162)",JASDAQ:7162,Investments & Asset Management,Japan,Japan,Japan
"Asukanet Co., Ltd. (TSE:2438)",TSE:2438,Business & Consumer Services,Japan,Japan,Japan
"Asunaro Aoki Construction Co.,Ltd. (TSE:1865)",TSE:1865,Engineering/Construction,Japan,Japan,Japan
"AT-Group Co., Ltd. (NSE:8293)",NSE:8293,Retail (Automotive),Japan,Japan,Japan
Ateam Inc. (TSE:3662),TSE:3662,Software (Internet),Japan,Japan,Japan
Atect Corporation (JASDAQ:4241),JASDAQ:4241,Semiconductor Equip,Japan,Japan,Japan
ATOM Corporation (TSE:7412),TSE:7412,Restaurant/Dining,Japan,Japan,Japan
"Atom Livin Tech Co.,Ltd. (JASDAQ:3426)",JASDAQ:3426,Building Materials,Japan,Japan,Japan
Atomix Co. Ltd. (JASDAQ:4625),JASDAQ:4625,Chemical (Specialty),Japan,Japan,Japan
"Atsugi Co.,Ltd. (TSE:3529)",TSE:3529,Apparel,Japan,Japan,Japan
AuBEX CORPORATION (TSE:3583),TSE:3583,Office Equipment & Services,Japan,Japan,Japan
"Aucfan Co., Ltd. (TSE:3674)",TSE:3674,Software (Internet),Japan,Japan,Japan
"AUN Consulting, Inc. (TSE:2459)",TSE:2459,Software (Internet),Japan,Japan,Japan
"Auto Server Co., Ltd. (GTSM:5266)",GTSM:5266,Software (Internet),Japan,Japan,Japan
"Autobacs Seven Co., Ltd. (TSE:9832)",TSE:9832,Retail (Automotive),Japan,Japan,Japan
"AUTOWAVE Co., Ltd. (JASDAQ:2666)",JASDAQ:2666,Retail (Automotive),Japan,Japan,Japan
Aval Data Corporation (JASDAQ:6918),JASDAQ:6918,Semiconductor Equip,Japan,Japan,Japan
Avant Corporation (JASDAQ:3836),JASDAQ:3836,Software (System & Application),Japan,Japan,Japan
Avex Group Holdings Inc. (TSE:7860),TSE:7860,Entertainment,Japan,Japan,Japan
AViX Inc. (JASDAQ:7836),JASDAQ:7836,Semiconductor,Japan,Japan,Japan
"Awa Paper Mfg. Co., Ltd. (TSE:3896)",TSE:3896,Paper/Forest Products,Japan,Japan,Japan
Axel Mark Inc. (TSE:3624),TSE:3624,Software (System & Application),Japan,Japan,Japan
AXELL Corporation (TSE:6730),TSE:6730,Semiconductor,Japan,Japan,Japan
Axial Retailing Inc. (TSE:8255),TSE:8255,Retail (Grocery and Food),Japan,Japan,Japan
"AXYZ Co., Ltd. (JASDAQ:1381)",JASDAQ:1381,Food Processing,Japan,Japan,Japan
Azbil Corporation (TSE:6845),TSE:6845,Electronics (General),Japan,Japan,Japan
Azearth Corporation (TSE:3161),TSE:3161,Apparel,Japan,Japan,Japan
"Azia Co., Ltd. (TSE:2352)",TSE:2352,Software (Internet),Japan,Japan,Japan
"Azuma House Co.,Ltd. (JASDAQ:3293)",JASDAQ:3293,Homebuilding,Japan,Japan,Japan
"Azuma Shipping Co., Ltd. (TSE:9380)",TSE:9380,Shipbuilding & Marine,Japan,Japan,Japan
B-Lot Company Limited (TSE:3452),TSE:3452,Real Estate (Operations & Services),Japan,Japan,Japan
"B-R 31 Ice Cream Co., Ltd. (JASDAQ:2268)",JASDAQ:2268,Restaurant/Dining,Japan,Japan,Japan
"Balnibarbi Co.,Ltd. (TSE:3418)",TSE:3418,Restaurant/Dining,Japan,Japan,Japan
BANDAI NAMCO Holdings Inc. (TSE:7832),TSE:7832,Recreation,Japan,Japan,Japan
"Bando Chemical Industries, Ltd. (TSE:5195)",TSE:5195,Machinery,Japan,Japan,Japan
Bank of Iwate Ltd. (TSE:8345),TSE:8345,Banks (Regional),Japan,Japan,Japan
Bank of Japan (JASDAQ:8301),JASDAQ:8301,Financial Svcs. (Non-bank & Insurance),Japan,Japan,Japan
Bank of the Ryukyus Ltd. (TSE:8399),TSE:8399,Banks (Regional),Japan,Japan,Japan
"Banners Co., Ltd. (TSE:3011)",TSE:3011,Retail (Automotive),Japan,Japan,Japan
Beauty Garage Inc. (TSE:3180),TSE:3180,Business & Consumer Services,Japan,Japan,Japan
"Beauty Kadan Co., Ltd. (TSE:3041)",TSE:3041,Business & Consumer Services,Japan,Japan,Japan
Beenos Inc. (TSE:3328),TSE:3328,Retail (Online),Japan,Japan,Japan
"Being Co., Ltd. (JASDAQ:4734)",JASDAQ:4734,Software (System & Application),Japan,Japan,Japan
"Belc CO., LTD. (TSE:9974)",TSE:9974,Retail (Grocery and Food),Japan,Japan,Japan
"Bell-Park Co.,Ltd. (JASDAQ:9441)",JASDAQ:9441,Retail (Special Lines),Japan,Japan,Japan
"BELLSYSTEM24 Holdings, Inc. (TSE:6183)",TSE:6183,Office Equipment & Services,Japan,Japan,Japan
Belluna Co. Ltd. (TSE:9997),TSE:9997,Retail (Special Lines),Japan,Japan,Japan
"BeMap, Inc. (JASDAQ:4316)",JASDAQ:4316,Computer Services,Japan,Japan,Japan
Benefit One Inc. (TSE:2412),TSE:2412,Business & Consumer Services,Japan,Japan,Japan
"Benesse Holdings, Inc. (TSE:9783)",TSE:9783,Education,Japan,Japan,Japan
"Bengo4.com, Inc. (TSE:6027)",TSE:6027,Software (Internet),Japan,Japan,Japan
"Berg Earth Co.,Ltd. (JASDAQ:1383)",JASDAQ:1383,Farming/Agriculture,Japan,Japan,Japan
Best Denki Co. Ltd. (TSE:8175),TSE:8175,Retail (Special Lines),Japan,Japan,Japan
"Besterra Co., Ltd. (TSE:1433)",TSE:1433,Engineering/Construction,Japan,Japan,Japan
Bic Camera Inc. (TSE:3048),TSE:3048,Retail (Special Lines),Japan,Japan,Japan
BIKE-O & COMPANY Ltd. (TSE:3377),TSE:3377,Retail (Automotive),Japan,Japan,Japan
Biken Techno Corporation (TSE:9791),TSE:9791,Environmental & Waste Services,Japan,Japan,Japan
Billing System Corporation (TSE:3623),TSE:3623,Information Services,Japan,Japan,Japan
"Biofermin Pharmaceutical Co., Ltd. (TSE:4517)",TSE:4517,Drugs (Pharmaceutical),Japan,Japan,Japan
BML Inc. (TSE:4694),TSE:4694,Healthcare Support Services,Japan,Japan,Japan
Bookoff Corporation Limited (TSE:3313),TSE:3313,Retail (Special Lines),Japan,Japan,Japan
"Boso oil and fat Co.,Ltd. (TSE:2608)",TSE:2608,Food Processing,Japan,Japan,Japan
Bourbon Corporation (TSE:2208),TSE:2208,Food Processing,Japan,Japan,Japan
BP Castrol K.K. (TSE:5015),TSE:5015,Oilfield Svcs/Equip.,Japan,Japan,Japan
Br. Holdings Corporation (TSE:1726),TSE:1726,Engineering/Construction,Japan,Japan,Japan
BrainPad Inc. (TSE:3655),TSE:3655,Computer Services,Japan,Japan,Japan
Brangista Inc. (TSE:6176),TSE:6176,Publshing & Newspapers,Japan,Japan,Japan
Bridgestone Corp. (TSE:5108),TSE:5108,Rubber& Tires,Japan,Japan,Japan
"Broadband Tower, Inc. (JASDAQ:3776)",JASDAQ:3776,Computer Services,Japan,Japan,Japan
Broadcasting System of Niigata Inc. (JASDAQ:9408),JASDAQ:9408,Information Services,Japan,Japan,Japan
"Broadleaf Co., Ltd. (TSE:3673)",TSE:3673,Software (System & Application),Japan,Japan,Japan
Broadmedia Corporation (JASDAQ:4347),JASDAQ:4347,Telecom. Services,Japan,Japan,Japan
"Broccoli Co., Ltd. (JASDAQ:2706)",JASDAQ:2706,Entertainment,Japan,Japan,Japan
"Bronco Billy Co.,Ltd. (TSE:3091)",TSE:3091,Restaurant/Dining,Japan,Japan,Japan
"Brother Industries, Ltd. (TSE:6448)",TSE:6448,Computers/Peripherals,Japan,Japan,Japan
"Buffalo Co., Ltd. (JASDAQ:3352)",JASDAQ:3352,Retail (Automotive),Japan,Japan,Japan
"Bull-Dog Sauce Co.,Ltd. (TSE:2804)",TSE:2804,Food Processing,Japan,Japan,Japan
Bunka Shutter Co. Ltd. (TSE:5930),TSE:5930,Building Materials,Japan,Japan,Japan
"Bunkeido Co., Ltd. (NSE:9471)",NSE:9471,Publshing & Newspapers,Japan,Japan,Japan
