"Retail Partners Co., Ltd. (TSE:8167)",TSE:8167,Retail (Grocery and Food),Japan,Japan,Japan
"Rheon Automatic Machinery Co., Ltd. (TSE:6272)",TSE:6272,Machinery,Japan,Japan,Japan
"Rhythm Watch Co., Ltd. (TSE:7769)",TSE:7769,Apparel,Japan,Japan,Japan
Riberesute Corporation (JASDAQ:8887),JASDAQ:8887,Homebuilding,Japan,Japan,Japan
Ribomic Inc. (TSE:4591),TSE:4591,Drugs (Biotechnology),Japan,Japan,Japan
"Ricoh Company, Ltd. (TSE:7752)",TSE:7752,Computers/Peripherals,Japan,Japan,Japan
"Ricoh Leasing Company, Ltd. (TSE:8566)",TSE:8566,Financial Svcs. (Non-bank & Insurance),Japan,Japan,Japan
"Ride On Express Co., Ltd. (TSE:6082)",TSE:6082,Restaurant/Dining,Japan,Japan,Japan
"RIGHT ON Co., Ltd. (TSE:7445)",TSE:7445,Retail (Special Lines),Japan,Japan,Japan
Rikei Corporation (TSE:8226),TSE:8226,Computer Services,Japan,Japan,Japan
Riken Corporation (TSE:6462),TSE:6462,Auto Parts,Japan,Japan,Japan
Riken Corundum Company Limited (TSE:5395),TSE:5395,Building Materials,Japan,Japan,Japan
"Riken Keiki Co., Ltd. (TSE:7734)",TSE:7734,Electronics (General),Japan,Japan,Japan
Riken Technos Corporation (TSE:4220),TSE:4220,Chemical (Basic),Japan,Japan,Japan
"Riken Vitamin Co., Ltd. (TSE:4526)",TSE:4526,Food Processing,Japan,Japan,Japan
"Rikengreen Co., Ltd. (JASDAQ:9992)",JASDAQ:9992,Retail (Distributors),Japan,Japan,Japan
Ringer Hut Co. Ltd. (TSE:8200),TSE:8200,Restaurant/Dining,Japan,Japan,Japan
Rinko Corporation (TSE:9355),TSE:9355,Shipbuilding & Marine,Japan,Japan,Japan
Rinnai Corporation (TSE:5947),TSE:5947,Furn/Home Furnishings,Japan,Japan,Japan
"Rion Co., Ltd. (TSE:6823)",TSE:6823,Healthcare Products,Japan,Japan,Japan
"RISE, Inc. (JASDAQ:8836)",JASDAQ:8836,Real Estate (General/Diversified),Japan,Japan,Japan
RiskMonster.com (JASDAQ:3768),JASDAQ:3768,Business & Consumer Services,Japan,Japan,Japan
Riso Kagaku Corporation (TSE:6413),TSE:6413,Computers/Peripherals,Japan,Japan,Japan
"Riso Kyoiku Co., Ltd. (TSE:4714)",TSE:4714,Education,Japan,Japan,Japan
River Eletec Corporation (JASDAQ:6666),JASDAQ:6666,Electronics (General),Japan,Japan,Japan
Rix Corporation (TSE:7525),TSE:7525,Machinery,Japan,Japan,Japan
RKB Mainichi Broadcasting Corporation (FKSE:9407),FKSE:9407,Broadcasting,Japan,Japan,Japan
"Rock Field Co., Ltd. (TSE:2910)",TSE:2910,Food Processing,Japan,Japan,Japan
"ROCK PAINT Co., Ltd. (TSE:4621)",TSE:4621,Chemical (Basic),Japan,Japan,Japan
"ROHM Co., Ltd. (TSE:6963)",TSE:6963,Semiconductor,Japan,Japan,Japan
"Rohto Pharmaceutical Co., Ltd. (TSE:4527)",TSE:4527,Drugs (Pharmaceutical),Japan,Japan,Japan
"Rokko Butter Co., Ltd. (TSE:2266)",TSE:2266,Food Processing,Japan,Japan,Japan
Roland DG Corporation (TSE:6789),TSE:6789,Computers/Peripherals,Japan,Japan,Japan
Rorze Corporation (JASDAQ:6323),JASDAQ:6323,Semiconductor Equip,Japan,Japan,Japan
Round One Corporation (TSE:4680),TSE:4680,Recreation,Japan,Japan,Japan
"Royal Electric Co.,Ltd. (JASDAQ:6593)",JASDAQ:6593,Building Materials,Japan,Japan,Japan
"Royal Holdings Co., Ltd. (TSE:8179)",TSE:8179,Restaurant/Dining,Japan,Japan,Japan
Rozetta Corporation (TSE:6182),TSE:6182,Business & Consumer Services,Japan,Japan,Japan
"RS Technologies Co., Ltd. (TSE:3445)",TSE:3445,Semiconductor,Japan,Japan,Japan
"Ruden Holdings Co., Ltd. (JASDAQ:1400)",JASDAQ:1400,Engineering/Construction,Japan,Japan,Japan
Runsystems Co. Ltd. (JASDAQ:3326),JASDAQ:3326,Recreation,Japan,Japan,Japan
RVH Inc. (TSE:6786),TSE:6786,Electronics (General),Japan,Japan,Japan
Ryobi Ltd. (TSE:5851),TSE:5851,Machinery,Japan,Japan,Japan
"Ryoden Trading Company, Limited (TSE:8084)",TSE:8084,Computer Services,Japan,Japan,Japan
"Ryohin Keikaku Co., Ltd. (TSE:7453)",TSE:7453,Retail (General),Japan,Japan,Japan
"Ryomo Systems Co.,Ltd. (JASDAQ:9691)",JASDAQ:9691,Computer Services,Japan,Japan,Japan
"Ryosan Company, Limited (TSE:8140)",TSE:8140,Computer Services,Japan,Japan,Japan
Ryoyo Electro Corp. (TSE:8068),TSE:8068,Computer Services,Japan,Japan,Japan
"Ryoyu Systems Co., Ltd. (JASDAQ:4685)",JASDAQ:4685,Computer Services,Japan,Japan,Japan
S Foods Inc. (TSE:2292),TSE:2292,Food Processing,Japan,Japan,Japan
"S Line Co.,Ltd. (NSE:9078)",NSE:9078,Trucking,Japan,Japan,Japan
"S Science Company, Ltd. (TSE:5721)",TSE:5721,Metals & Mining,Japan,Japan,Japan
"S Trust  Co., Ltd. (TSE:3280)",TSE:3280,Real Estate (Development),Japan,Japan,Japan
"S-Pool, Inc. (JASDAQ:2471)",JASDAQ:2471,Business & Consumer Services,Japan,Japan,Japan
"S. Ishimitsu & Co., Ltd. (JASDAQ:2750)",JASDAQ:2750,Food Wholesalers,Japan,Japan,Japan
S.T. Corporation (TSE:4951),TSE:4951,Household Products,Japan,Japan,Japan
"S&B Foods, Inc. (TSE:2805)",TSE:2805,Food Processing,Japan,Japan,Japan
Sac's Bar Holdings Inc. (TSE:9990),TSE:9990,Retail (Special Lines),Japan,Japan,Japan
Sacos Corporation (JASDAQ:9641),JASDAQ:9641,Retail (Distributors),Japan,Japan,Japan
"SADAMATSU Co., Ltd. (JASDAQ:2736)",JASDAQ:2736,Retail (Special Lines),Japan,Japan,Japan
"Sado Steam Ship Co., Ltd. (JASDAQ:9176)",JASDAQ:9176,Shipbuilding & Marine,Japan,Japan,Japan
"Saftec Co.,Ltd. (JASDAQ:7464)",JASDAQ:7464,Retail (Distributors),Japan,Japan,Japan
Sagami Chain Co. Ltd. (TSE:9900),TSE:9900,Restaurant/Dining,Japan,Japan,Japan
"Sagami Co., Ltd. (TSE:8201)",TSE:8201,Retail (Special Lines),Japan,Japan,Japan
"Sagami Rubber Industries Co., Ltd. (TSE:5194)",TSE:5194,Household Products,Japan,Japan,Japan
"SAIBO Co., Ltd. (TSE:3123)",TSE:3123,Apparel,Japan,Japan,Japan
"Saibu Gas Co., Ltd. (TSE:9536)",TSE:9536,Power,Japan,Japan,Japan
"Saikaya Co., Ltd. (TSE:8254)",TSE:8254,Retail (General),Japan,Japan,Japan
"Saint Marc Holdings Co., Ltd. (TSE:3395)",TSE:3395,Restaurant/Dining,Japan,Japan,Japan
Saint-Care Holding Corporation (JASDAQ:2374),JASDAQ:2374,Hospitals/Healthcare Facilities,Japan,Japan,Japan
"Saison Information Systems Co., Ltd. (JASDAQ:9640)",JASDAQ:9640,Computer Services,Japan,Japan,Japan
Saita Corporation (FKSE:1999),FKSE:1999,Engineering/Construction,Japan,Japan,Japan
Saizeriya Co. Ltd. (TSE:7581),TSE:7581,Restaurant/Dining,Japan,Japan,Japan
Sakae Electronics Corp. (JASDAQ:7567),JASDAQ:7567,Computer Services,Japan,Japan,Japan
"Sakai Chemical Industry Co., Ltd. (TSE:4078)",TSE:4078,Chemical (Diversified),Japan,Japan,Japan
"Sakai Heavy Industries, Ltd. (TSE:6358)",TSE:6358,Construction Supplies,Japan,Japan,Japan
"Sakai Moving Service Co.,Ltd. (TSE:9039)",TSE:9039,Trucking,Japan,Japan,Japan
"Sakai Ovex Co., Ltd. (TSE:3408)",TSE:3408,Apparel,Japan,Japan,Japan
"Sakai Trading Co., Ltd. (TSE:9967)",TSE:9967,Retail (Distributors),Japan,Japan,Japan
Sakata INX Corporation (TSE:4633),TSE:4633,Chemical (Specialty),Japan,Japan,Japan
Sakata Seed Corp. (TSE:1377),TSE:1377,Farming/Agriculture,Japan,Japan,Japan
SAKHA DIAMOND Corp. (JASDAQ:9898),JASDAQ:9898,Retail (Distributors),Japan,Japan,Japan
Sakura Internet Inc. (TSE:3778),TSE:3778,Software (Internet),Japan,Japan,Japan
SAKURA KCS Corporation (TSE:4761),TSE:4761,Computer Services,Japan,Japan,Japan
"Sakura Rubber Co., Ltd. (TSE:5189)",TSE:5189,Machinery,Japan,Japan,Japan
Sakurai Ltd. (JASDAQ:7255),JASDAQ:7255,Auto Parts,Japan,Japan,Japan
"Sakurajima Futo Kaisha, Ltd. (TSE:9353)",TSE:9353,Shipbuilding & Marine,Japan,Japan,Japan
SALA Corporation (TSE:2734),TSE:2734,Oilfield Svcs/Equip.,Japan,Japan,Japan
Sala House Co. Ltd. (TSE:1405),TSE:1405,Homebuilding,Japan,Japan,Japan
Samantha Thavasa Japan Limited (TSE:7829),TSE:7829,Apparel,Japan,Japan,Japan
SAMCO Inc. (TSE:6387),TSE:6387,Semiconductor Equip,Japan,Japan,Japan
"Samty Co., Ltd. (TSE:3244)",TSE:3244,Real Estate (General/Diversified),Japan,Japan,Japan
Samty Residential Investment Corporation (TSE:3459),TSE:3459,R.E.I.T.,Japan,Japan,Japan
"SAN Holdings, Inc. (TSE:9628)",TSE:9628,Business & Consumer Services,Japan,Japan,Japan
"SAN-A & CO.,LTD. (TSE:2659)",TSE:2659,Retail (Grocery and Food),Japan,Japan,Japan
"San-Ai Oil Co., Ltd. (TSE:8097)",TSE:8097,Oilfield Svcs/Equip.,Japan,Japan,Japan
SanBio Company Limited (TSE:4592),TSE:4592,Drugs (Biotechnology),Japan,Japan,Japan
Sanden Holdings Corporation (TSE:6444),TSE:6444,Auto Parts,Japan,Japan,Japan
"Sanei Architecture Planning Co.,Ltd. (TSE:3228)",TSE:3228,Homebuilding,Japan,Japan,Japan
Sangetsu Co. Ltd. (TSE:8130),TSE:8130,Furn/Home Furnishings,Japan,Japan,Japan
Sanix Inc. (TSE:4651),TSE:4651,Environmental & Waste Services,Japan,Japan,Japan
"Sankei Chemical Co.,Ltd. (FKSE:4995)",FKSE:4995,Chemical (Specialty),Japan,Japan,Japan
Sanken Electric Co. Ltd. (TSE:6707),TSE:6707,Semiconductor,Japan,Japan,Japan
"Sanki Engineering Co., Ltd. (TSE:1961)",TSE:1961,Engineering/Construction,Japan,Japan,Japan
"Sanko Co., Ltd. (TSE:6964)",TSE:6964,Electronics (General),Japan,Japan,Japan
Sanko Gosei Ltd. (JASDAQ:7888),JASDAQ:7888,Machinery,Japan,Japan,Japan
"Sanko Marketing Foods Co., Ltd. (TSE:2762)",TSE:2762,Restaurant/Dining,Japan,Japan,Japan
"Sanko Metal Industrial Co., Ltd. (TSE:1972)",TSE:1972,Building Materials,Japan,Japan,Japan
"Sanko Sangyo Co.,Ltd. (JASDAQ:7922)",JASDAQ:7922,Publshing & Newspapers,Japan,Japan,Japan
"Sanko Techno Co., Ltd. (TSE:3435)",TSE:3435,Machinery,Japan,Japan,Japan
"Sankyo Co., Ltd. (TSE:6417)",TSE:6417,Recreation,Japan,Japan,Japan
"Sankyo Frontier. Co., Ltd. (JASDAQ:9639)",JASDAQ:9639,Real Estate (General/Diversified),Japan,Japan,Japan
Sankyo Kasei Corporation (TSE:8138),TSE:8138,Retail (Distributors),Japan,Japan,Japan
Sankyo Seiko Co. Ltd. (TSE:8018),TSE:8018,Retail (Distributors),Japan,Japan,Japan
"Sankyo Tateyama, Inc. (TSE:5932)",TSE:5932,Building Materials,Japan,Japan,Japan
"Sankyu, Inc. (TSE:9065)",TSE:9065,Trucking,Japan,Japan,Japan
"Sanno Co.,Ltd. (JASDAQ:3441)",JASDAQ:3441,Machinery,Japan,Japan,Japan
"Sanoh Industrial Co., Ltd. (TSE:6584)",TSE:6584,Auto Parts,Japan,Japan,Japan
Sanoyas Holdings Corporation (TSE:7022),TSE:7022,Construction Supplies,Japan,Japan,Japan
"Sanrin Co., Ltd. (JASDAQ:7486)",JASDAQ:7486,Oilfield Svcs/Equip.,Japan,Japan,Japan
"Sanrio Company, Ltd. (TSE:8136)",TSE:8136,Retail (Special Lines),Japan,Japan,Japan
Sanritsu Corporation (TSE:9366),TSE:9366,Business & Consumer Services,Japan,Japan,Japan
"Sansei Co.,Ltd. (TSE:6307)",TSE:6307,Machinery,Japan,Japan,Japan
Sansei Landic Company Limited (TSE:3277),TSE:3277,Real Estate (General/Diversified),Japan,Japan,Japan
"Sansei Technologies, Inc. (TSE:6357)",TSE:6357,Machinery,Japan,Japan,Japan
"Sansha Electric Manufacturing Co., Ltd. (TSE:6882)",TSE:6882,Electrical Equipment,Japan,Japan,Japan
Sanshin Corporation (JASDAQ:1984),JASDAQ:1984,Engineering/Construction,Japan,Japan,Japan
"Sanshin Electronics Co., Ltd. (TSE:8150)",TSE:8150,Computer Services,Japan,Japan,Japan
"Sanso Electric Co.,Ltd. (JASDAQ:6518)",JASDAQ:6518,Machinery,Japan,Japan,Japan
Santec Corporation (JASDAQ:6777),JASDAQ:6777,Electronics (General),Japan,Japan,Japan
Santen Pharmaceutical Co. Ltd. (TSE:4536),TSE:4536,Drugs (Pharmaceutical),Japan,Japan,Japan
"Santo Co.,Ltd. (JASDAQ:1788)",JASDAQ:1788,Engineering/Construction,Japan,Japan,Japan
Sanwa Company Ltd. (TSE:3187),TSE:3187,Retail (Online),Japan,Japan,Japan
Sanwa Holdings Corporation (TSE:5929),TSE:5929,Building Materials,Japan,Japan,Japan
Sanyei Corporation (JASDAQ:8119),JASDAQ:8119,Retail (Distributors),Japan,Japan,Japan
Sanyo Chemical Industries Ltd. (TSE:4471),TSE:4471,Chemical (Specialty),Japan,Japan,Japan
"Sanyo Denki Co., Ltd. (TSE:6516)",TSE:6516,Electrical Equipment,Japan,Japan,Japan
"Sanyo Department Store Co., Ltd. (JASDAQ:8257)",JASDAQ:8257,Retail (General),Japan,Japan,Japan
"Sanyo Electric Railway Co.,Ltd. (TSE:9052)",TSE:9052,Retail (General),Japan,Japan,Japan
Sanyo Engineering & Construction Inc. (TSE:1960),TSE:1960,Engineering/Construction,Japan,Japan,Japan
Sanyo Homes Corporation (TSE:1420),TSE:1420,Homebuilding,Japan,Japan,Japan
"Sanyo Housing Nagoya Co., Ltd. (TSE:8904)",TSE:8904,Homebuilding,Japan,Japan,Japan
"Sanyo Industries, Ltd. (TSE:5958)",TSE:5958,Building Materials,Japan,Japan,Japan
Sanyo Shokai Ltd. (TSE:8011),TSE:8011,Apparel,Japan,Japan,Japan
Sanyo Special Steel Co. Ltd. (TSE:5481),TSE:5481,Steel,Japan,Japan,Japan
"Sanyo Trading Co., Ltd. (TSE:3176)",TSE:3176,Retail (Distributors),Japan,Japan,Japan
Sanyodo Holdings Inc (JASDAQ:3058),JASDAQ:3058,Retail (Special Lines),Japan,Japan,Japan
"Sanyu Co., Ltd. (TSE:5697)",TSE:5697,Steel,Japan,Japan,Japan
"Sanyu Construction Co.,Ltd. (JASDAQ:1841)",JASDAQ:1841,Engineering/Construction,Japan,Japan,Japan
Sapporo Clinical Laboratory Inc. (JASDAQ:9776),JASDAQ:9776,Retail (Special Lines),Japan,Japan,Japan
Sapporo Drug Store Co. Ltd. (TSE:2786),TSE:2786,Retail (Special Lines),Japan,Japan,Japan
Sapporo Holdings Ltd. (TSE:2501),TSE:2501,Beverage (Alcoholic),Japan,Japan,Japan
"Sasakura Engineering Co., Ltd. (TSE:6303)",TSE:6303,Machinery,Japan,Japan,Japan
"Sata Construction Co., Ltd. (TSE:1826)",TSE:1826,Engineering/Construction,Japan,Japan,Japan
"Sato Foods Co., Ltd. (TSE:2923)",TSE:2923,Food Processing,Japan,Japan,Japan
"Sato Foods Industries Co.,Ltd. (JASDAQ:2814)",JASDAQ:2814,Food Processing,Japan,Japan,Japan
Sato Holdings Corporation (TSE:6287),TSE:6287,Office Equipment & Services,Japan,Japan,Japan
"Sato Restaurant Systems Co., Ltd. (TSE:8163)",TSE:8163,Restaurant/Dining,Japan,Japan,Japan
Sato Shoji Corporation (TSE:8065),TSE:8065,Retail (Distributors),Japan,Japan,Japan
"Satoh & Co., Ltd. (JASDAQ:9996)",JASDAQ:9996,Food Wholesalers,Japan,Japan,Japan
Satori Electric Co. Ltd. (TSE:7420),TSE:7420,Computer Services,Japan,Japan,Japan
"Sawada Holdings Co., Ltd. (JASDAQ:8699)",JASDAQ:8699,Brokerage & Investment Banking,Japan,Japan,Japan
"Sawafuji Electric Co.,Ltd. (TSE:6901)",TSE:6901,Electrical Equipment,Japan,Japan,Japan
Sawai Pharmaceutical Co. Ltd. (TSE:4555),TSE:4555,Drugs (Pharmaceutical),Japan,Japan,Japan
"SAXA Holdings, Inc. (TSE:6675)",TSE:6675,Telecom. Equipment,Japan,Japan,Japan
"Saylor Advertising, Inc. (JASDAQ:2156)",JASDAQ:2156,Advertising,Japan,Japan,Japan
"SBI Holdings, Inc. (TSE:8473)",TSE:8473,Investments & Asset Management,Japan,Japan,Japan
"SBS Holdings, Inc. (TSE:2384)",TSE:2384,Transportation,Japan,Japan,Japan
"Scigineer, Inc. (TSE:6031)",TSE:6031,Software (Internet),Japan,Japan,Japan
Scinex Corporation (TSE:2376),TSE:2376,Publshing & Newspapers,Japan,Japan,Japan
"SCREEN Holdings Co., Ltd. (TSE:7735)",TSE:7735,Semiconductor Equip,Japan,Japan,Japan
Scroll Corporation (TSE:8005),TSE:8005,Retail (Special Lines),Japan,Japan,Japan
SCSK Corporation (TSE:9719),TSE:9719,Computer Services,Japan,Japan,Japan
SD Entertainment Inc. (JASDAQ:4650),JASDAQ:4650,Recreation,Japan,Japan,Japan
SDS Biotech K.K. (TSE:4952),TSE:4952,Chemical (Specialty),Japan,Japan,Japan
SE Corp. (JASDAQ:3423),JASDAQ:3423,Construction Supplies,Japan,Japan,Japan
"SE Holdings and Incubations Co., Ltd. (JASDAQ:9478)",JASDAQ:9478,Publshing & Newspapers,Japan,Japan,Japan
"Sec Carbon, Limited (TSE:5304)",TSE:5304,Electrical Equipment,Japan,Japan,Japan
"SECOM CO.,LTD. (TSE:9735)",TSE:9735,Business & Consumer Services,Japan,Japan,Japan
"Secom Joshinetsu Co., Ltd. (TSE:4342)",TSE:4342,Business & Consumer Services,Japan,Japan,Japan
SecuAvail Inc. (JASDAQ:3042),JASDAQ:3042,Computer Services,Japan,Japan,Japan
"Seed Co.,Ltd. (TSE:7743)",TSE:7743,Healthcare Products,Japan,Japan,Japan
"SeedHeiwa Co., Ltd. (JASDAQ:1739)",JASDAQ:1739,Engineering/Construction,Japan,Japan,Japan
Sega Sammy Holdings Inc. (TSE:6460),TSE:6460,Recreation,Japan,Japan,Japan
"Seibu Electric & Machinery Co., Ltd. (TSE:6144)",TSE:6144,Machinery,Japan,Japan,Japan
"Seibu Electric Industry Co., Ltd. (TSE:1937)",TSE:1937,Engineering/Construction,Japan,Japan,Japan
Seibu Holdings Inc. (TSE:9024),TSE:9024,Diversified,Japan,Japan,Japan
"Seigakusya Co., Ltd. (JASDAQ:2179)",JASDAQ:2179,Education,Japan,Japan,Japan
"Seihyo Co., Ltd. (TSE:2872)",TSE:2872,Food Processing,Japan,Japan,Japan
Seika Corporation (TSE:8061),TSE:8061,Retail (Distributors),Japan,Japan,Japan
Seikagaku Corp. (TSE:4548),TSE:4548,Drugs (Pharmaceutical),Japan,Japan,Japan
"Seikitokyu Kogyo Co., Ltd. (TSE:1898)",TSE:1898,Engineering/Construction,Japan,Japan,Japan
Seiko Corporation (JASDAQ:6286),JASDAQ:6286,Machinery,Japan,Japan,Japan
"Seiko Electric Co.,Ltd. (FKSE:6653)",FKSE:6653,Electrical Equipment,Japan,Japan,Japan
Seiko Epson Corp. (TSE:6724),TSE:6724,Computers/Peripherals,Japan,Japan,Japan
Seiko Holdings Corporation (TSE:8050),TSE:8050,Apparel,Japan,Japan,Japan
Seiko PMC Corporation (TSE:4963),TSE:4963,Chemical (Specialty),Japan,Japan,Japan
"SEIKOH GIKEN Co., Ltd. (JASDAQ:6834)",JASDAQ:6834,Electronics (General),Japan,Japan,Japan
"Seino Holdings Co., Ltd. (TSE:9076)",TSE:9076,Trucking,Japan,Japan,Japan
"Seiren Co., Ltd. (TSE:3569)",TSE:3569,Apparel,Japan,Japan,Japan
Seiryo Electric Corporation (TSE:4341),TSE:4341,Computer Services,Japan,Japan,Japan
Seiwa Chuo Holdings Corporation (JASDAQ:7531),JASDAQ:7531,Retail (Distributors),Japan,Japan,Japan
"Seiwa Electric Mfg. Co.,Ltd. (TSE:6748)",TSE:6748,Electrical Equipment,Japan,Japan,Japan
"Seki Co., Ltd. (JASDAQ:7857)",JASDAQ:7857,Publshing & Newspapers,Japan,Japan,Japan
"Sekichu Co.,Ltd. (JASDAQ:9976)",JASDAQ:9976,Retail (Building Supply),Japan,Japan,Japan
"SEKIDO Co., Ltd. (TSE:9878)",TSE:9878,Retail (General),Japan,Japan,Japan
"Sekisui Chemical Co., Ltd. (TSE:4204)",TSE:4204,Homebuilding,Japan,Japan,Japan
Sekisui House Ltd. (TSE:1928),TSE:1928,Homebuilding,Japan,Japan,Japan
"Sekisui House Reit, Inc. (TSE:3309)",TSE:3309,R.E.I.T.,Japan,Japan,Japan
Sekisui Jushi Corporation (TSE:4212),TSE:4212,Building Materials,Japan,Japan,Japan
"Sekisui Plastics Co., Ltd. (TSE:4228)",TSE:4228,Chemical (Basic),Japan,Japan,Japan
Sekonic Holdings Corporation (TSE:7758),TSE:7758,Computers/Peripherals,Japan,Japan,Japan
"Semba Tohka Industries Co., Ltd (JASDAQ:2916)",JASDAQ:2916,Food Processing,Japan,Japan,Japan
SEMITEC Corporation (JASDAQ:6626),JASDAQ:6626,Electronics (General),Japan,Japan,Japan
"Senko Co., Ltd. (TSE:9069)",TSE:9069,Trucking,Japan,Japan,Japan
"Senkon Logistics Co., Ltd. (JASDAQ:9051)",JASDAQ:9051,Trucking,Japan,Japan,Japan
"Senshu Electric Co.,Ltd. (TSE:9824)",TSE:9824,Retail (Distributors),Japan,Japan,Japan
Senshu Ikeda Holdings Inc. (TSE:8714),TSE:8714,Banks (Regional),Japan,Japan,Japan
"Senshukai Co., Ltd. (TSE:8165)",TSE:8165,Retail (Special Lines),Japan,Japan,Japan
"Septeni Holdings Co., Ltd. (JASDAQ:4293)",JASDAQ:4293,Advertising,Japan,Japan,Japan
Seria Co. Ltd. (JASDAQ:2782),JASDAQ:2782,Retail (General),Japan,Japan,Japan
"Settsu Oil Mill, Inc. (TSE:2611)",TSE:2611,Diversified,Japan,Japan,Japan
"Seven & i Holdings Co., Ltd. (TSE:3382)",TSE:3382,Retail (Grocery and Food),Japan,Japan,Japan
Seven Bank Ltd. (TSE:8410),TSE:8410,Banks (Regional),Japan,Japan,Japan
"Seven Industries Co., Ltd. (TSE:7896)",TSE:7896,Building Materials,Japan,Japan,Japan
"Seven Seas Holdings Co.,Ltd. (TSE:3750)",TSE:3750,Advertising,Japan,Japan,Japan
"SFP Dining Co., Ltd. (TSE:3198)",TSE:3198,Restaurant/Dining,Japan,Japan,Japan
"Shaklee Global Group, Inc. (JASDAQ:8205)",JASDAQ:8205,Retail (Distributors),Japan,Japan,Japan
Sharp Corporation (TSE:6753),TSE:6753,Electronics (Consumer & Office),Japan,Japan,Japan
Shibaura Electronics Co. Ltd. (JASDAQ:6957),JASDAQ:6957,Electronics (General),Japan,Japan,Japan
Shibaura Mechatronics Corp. (TSE:6590),TSE:6590,Semiconductor Equip,Japan,Japan,Japan
Shibuya Corporation (TSE:6340),TSE:6340,Machinery,Japan,Japan,Japan
ShiDax Corp. (JASDAQ:4837),JASDAQ:4837,Restaurant/Dining,Japan,Japan,Japan
"SHIFT, Inc. (TSE:3697)",TSE:3697,Computer Services,Japan,Japan,Japan
"Shigematsu Works Co., Ltd. (JASDAQ:7980)",JASDAQ:7980,Office Equipment & Services,Japan,Japan,Japan
Shikibo Ltd. (TSE:3109),TSE:3109,Apparel,Japan,Japan,Japan
Shikoku Chemicals Corporation (TSE:4099),TSE:4099,Chemical (Diversified),Japan,Japan,Japan
Shikoku Electric Power Co. Inc. (TSE:9507),TSE:9507,Power,Japan,Japan,Japan
Shima Seiki Manufacturing Ltd. (TSE:6222),TSE:6222,Machinery,Japan,Japan,Japan
"Shimachu Co., Ltd. (TSE:8184)",TSE:8184,Retail (Building Supply),Japan,Japan,Japan
Shimadzu Corporation (TSE:7701),TSE:7701,Electronics (General),Japan,Japan,Japan
Shimamura Co. Ltd. (TSE:8227),TSE:8227,Retail (Special Lines),Japan,Japan,Japan
Shimano Inc. (TSE:7309),TSE:7309,Recreation,Japan,Japan,Japan
Shimizu Corp. (TSE:1803),TSE:1803,Engineering/Construction,Japan,Japan,Japan
"Shimojima Co., Ltd. (TSE:7482)",TSE:7482,Retail (Distributors),Japan,Japan,Japan
Shin Nippon Air Technologies Co. Ltd. (TSE:1952),TSE:1952,Building Materials,Japan,Japan,Japan
"Shin Nippon Biomedical Laboratories, Ltd. (TSE:2395)",TSE:2395,Heathcare Information and Technology,Japan,Japan,Japan
Shin Pro Maint.Inc (TSE:6086),TSE:6086,Business & Consumer Services,Japan,Japan,Japan
"Shin-Etsu Chemical Co., Ltd. (TSE:4063)",TSE:4063,Chemical (Specialty),Japan,Japan,Japan
Shin-Etsu Polymer Co. Ltd. (TSE:7970),TSE:7970,Chemical (Basic),Japan,Japan,Japan
"Shin-Keisei Electric Railway Co.,Ltd. (TSE:9014)",TSE:9014,Transportation (Railroads),Japan,Japan,Japan
"Shin-Nihon Tatemono Co., Ltd. (JASDAQ:8893)",JASDAQ:8893,Homebuilding,Japan,Japan,Japan
"Shinagawa Refractories Co., Ltd. (TSE:5351)",TSE:5351,Construction Supplies,Japan,Japan,Japan
Shinden Hightex Corporation (JASDAQ:3131),JASDAQ:3131,Computer Services,Japan,Japan,Japan
Shindengen Electric Manufacturing Co. Ltd. (TSE:6844),TSE:6844,Semiconductor,Japan,Japan,Japan
"Shingakukai Co., Ltd. (TSE:9760)",TSE:9760,Education,Japan,Japan,Japan
ShinHokoku Steel Corporation (JASDAQ:5542),JASDAQ:5542,Steel,Japan,Japan,Japan
Shinkawa Ltd. (TSE:6274),TSE:6274,Semiconductor Equip,Japan,Japan,Japan
"Shinki Bus Co.,Ltd. (TSE:9083)",TSE:9083,Trucking,Japan,Japan,Japan
"Shinko Electric Industries Co., Ltd. (TSE:6967)",TSE:6967,Semiconductor,Japan,Japan,Japan
"Shinko Plantech Co., Ltd. (TSE:6379)",TSE:6379,Oilfield Svcs/Equip.,Japan,Japan,Japan
Shinko Shoji Co. Ltd. (TSE:8141),TSE:8141,Computer Services,Japan,Japan,Japan
"Shinko Wire Company, Ltd. (TSE:5660)",TSE:5660,Steel,Japan,Japan,Japan
"ShinMaywa Industries, Ltd. (TSE:7224)",TSE:7224,Construction Supplies,Japan,Japan,Japan
Shinnaigai Textile Ltd. (TSE:3125),TSE:3125,Apparel,Japan,Japan,Japan
Shinnihon Corporation (TSE:1879),TSE:1879,Engineering/Construction,Japan,Japan,Japan
"Shinobu Foods Products Co., Ltd. (TSE:2903)",TSE:2903,Food Processing,Japan,Japan,Japan
"Shinoken Group Co., Ltd. (JASDAQ:8909)",JASDAQ:8909,Real Estate (General/Diversified),Japan,Japan,Japan
"Shinozakiya, Inc. (TSE:2926)",TSE:2926,Food Processing,Japan,Japan,Japan
"Shinpo Co., Ltd. (JASDAQ:5903)",JASDAQ:5903,Machinery,Japan,Japan,Japan
"Shinsei Bank, Limited (TSE:8303)",TSE:8303,Banks (Regional),Japan,Japan,Japan
"Shinseido Co., Ltd. (JASDAQ:7415)",JASDAQ:7415,Retail (Special Lines),Japan,Japan,Japan
Shinsho Corporation (TSE:8075),TSE:8075,Retail (Distributors),Japan,Japan,Japan
Shinto Company Limited (JASDAQ:5380),JASDAQ:5380,Building Materials,Japan,Japan,Japan
"Shinto Paint Co., Ltd. (TSE:4615)",TSE:4615,Chemical (Basic),Japan,Japan,Japan
"Shinwa Art Auction Co., Ltd. (JASDAQ:2437)",JASDAQ:2437,Business & Consumer Services,Japan,Japan,Japan
"Shinwa Co., Ltd. (TSE:7607)",TSE:7607,Machinery,Japan,Japan,Japan
Shinyei Kaisha (TSE:3004),TSE:3004,Retail (Distributors),Japan,Japan,Japan
"Shionogi & Co., Ltd. (TSE:4507)",TSE:4507,Drugs (Pharmaceutical),Japan,Japan,Japan
"Ship Healthcare Holdings, Inc. (TSE:3360)",TSE:3360,Healthcare Support Services,Japan,Japan,Japan
"Shirai Electronics Industrial Co., Ltd. (JASDAQ:6658)",JASDAQ:6658,Electronics (General),Japan,Japan,Japan
"Shirohato Co., Ltd. (JASDAQ:3192)",JASDAQ:3192,Retail (Online),Japan,Japan,Japan
SHIROKI Corporation (TSE:7243),TSE:7243,Auto Parts,Japan,Japan,Japan
"Shiseido Company, Limited (TSE:4911)",TSE:4911,Household Products,Japan,Japan,Japan
Shizuki Electric Company Inc. (TSE:6994),TSE:6994,Electronics (General),Japan,Japan,Japan
"Shizuoka Gas Co., Ltd. (TSE:9543)",TSE:9543,Power,Japan,Japan,Japan
SHL-Japan Ltd. (JASDAQ:4327),JASDAQ:4327,Business & Consumer Services,Japan,Japan,Japan
SHO-BI Corporation (TSE:7819),TSE:7819,Household Products,Japan,Japan,Japan
"Sho-Bond Holdings Co., Ltd. (TSE:1414)",TSE:1414,Engineering/Construction,Japan,Japan,Japan
"Shobunsha Publications, Inc. (TSE:9475)",TSE:9475,Publshing & Newspapers,Japan,Japan,Japan
"Shochiku Co., Ltd. (TSE:9601)",TSE:9601,Entertainment,Japan,Japan,Japan
"Shodensya Co., Ltd. (TSE:1711)",TSE:1711,Business & Consumer Services,Japan,Japan,Japan
"Shoei Co., Ltd. (TSE:7839)",TSE:7839,Auto Parts,Japan,Japan,Japan
Shoei Corporation (JASDAQ:9385),JASDAQ:9385,Packaging & Container,Japan,Japan,Japan
Shoei Foods Corporation (TSE:8079),TSE:8079,Food Wholesalers,Japan,Japan,Japan
Shofu Inc. (TSE:7979),TSE:7979,Healthcare Products,Japan,Japan,Japan
Shoko Co. Ltd. (TSE:8090),TSE:8090,Retail (Distributors),Japan,Japan,Japan
"Shokubun Co., Ltd (TSE:9969)",TSE:9969,Restaurant/Dining,Japan,Japan,Japan
"Showa Aircraft Industry Co., Ltd. (TSE:7404)",TSE:7404,Construction Supplies,Japan,Japan,Japan
"Showa Chemical Industry Co., Ltd. (TSE:4990)",TSE:4990,Chemical (Basic),Japan,Japan,Japan
Showa Corp. (TSE:7274),TSE:7274,Auto Parts,Japan,Japan,Japan
Showa Denko K.K. (TSE:4004),TSE:4004,Chemical (Diversified),Japan,Japan,Japan
"Showa Holdings Co., Ltd. (TSE:5103)",TSE:5103,Rubber& Tires,Japan,Japan,Japan
"Showa Manufacturing Co.,Ltd. (FKSE:5953)",FKSE:5953,Building Materials,Japan,Japan,Japan
Showa Paxxs Corporation (JASDAQ:3954),JASDAQ:3954,Packaging & Container,Japan,Japan,Japan
"Showa Sangyo Co., Ltd. (TSE:2004)",TSE:2004,Food Processing,Japan,Japan,Japan
Showa Shell Sekiyu K.K. (TSE:5002),TSE:5002,Oilfield Svcs/Equip.,Japan,Japan,Japan
"Showa Shinku Co., Ltd. (JASDAQ:6384)",JASDAQ:6384,Electronics (General),Japan,Japan,Japan
Showa System Engineering Corp. (JASDAQ:4752),JASDAQ:4752,Software (System & Application),Japan,Japan,Japan
Showcase-TV Inc. (TSE:3909),TSE:3909,Software (Internet),Japan,Japan,Japan
